{
    "Interest Rates": [
        [
            {
                "date": "12/31/2025",
                "raw_text": "16:00 Trade Date: 2025-12-31 (CLOSED)"
            },
            {
                "date": "01/01/2026",
                "raw_text": "16:00 Trade Date: 2026-01-02 (CLOSED) \n17:00 Trade Date: 2026-01-02 (OPEN)"
            },
            {
                "date": "01/02/2026",
                "raw_text": "16:00 Trade Date: 2026-01-02 (CLOSED)"
            }
        ],
        [
            {
                "date": "01/18/2026",
                "raw_text": "16:00 Trade Date: 2026-01-20 (CLOSED) \n17:00 Trade Date: 2026-01-20 (OPEN)"
            },
            {
                "date": "01/19/2026",
                "raw_text": "12:00 Trade Date: 2026-01-20 (CLOSED) \n17:00 Trade Date: 2026-01-20 (OPEN)"
            },
            {
                "date": "01/20/2026",
                "raw_text": "16:00 Trade Date: 2026-01-20 (CLOSED) \n16:45 Trade Date: 2026-01-21 (CLOSED) \n17:00 Trade Date: 2026-01-21 (OPEN)"
            }
        ],
        [
            {
                "date": "02/15/2026",
                "raw_text": "16:00 Trade Date: 2026-02-17 (CLOSED) \n17:00 Trade Date: 2026-02-17 (OPEN)"
            },
            {
                "date": "02/16/2026",
                "raw_text": "12:00 Trade Date: 2026-02-17 (CLOSED) \n17:00 Trade Date: 2026-02-17 (OPEN)"
            },
            {
                "date": "02/17/2026",
                "raw_text": "16:00 Trade Date: 2026-02-17 (CLOSED) \n16:45 Trade Date: 2026-02-18 (CLOSED) \n17:00 Trade Date: 2026-02-18 (OPEN)"
            }
        ],
        [
            {
                "date": "04/01/2026",
                "raw_text": "16:00 Trade Date: 2026-04-01 (CLOSED) \n16:45 Trade Date: 2026-04-02 (CLOSED) \n17:00 Trade Date: 2026-04-02 (OPEN)"
            },
            {
                "date": "04/02/2026",
                "raw_text": "16:00 Trade Date: 2026-04-02 (CLOSED) \n16:45 Trade Date: 2026-04-03 (CLOSED) \n17:00 Trade Date: 2026-04-03 (OPEN)"
            },
            {
                "date": "04/03/2026",
                "raw_text": "10:15 Trade Date: 2026-04-03 (CLOSED)"
            }
        ],
        [
            {
                "date": "05/24/2026",
                "raw_text": "16:00 Trade Date: 2026-05-26 (CLOSED) \n17:00 Trade Date: 2026-05-26 (OPEN)"
            },
            {
                "date": "05/25/2026",
                "raw_text": "12:00 Trade Date: 2026-05-26 (CLOSED) \n17:00 Trade Date: 2026-05-26 (OPEN)"
            },
            {
                "date": "05/26/2026",
                "raw_text": "16:00 Trade Date: 2026-05-26 (CLOSED) \n16:45 Trade Date: 2026-05-27 (CLOSED) \n17:00 Trade Date: 2026-05-27 (OPEN)"
            }
        ],
        [
            {
                "date": "06/17/2026",
                "raw_text": "16:00 Trade Date: 2026-06-17 (CLOSED) \n16:45 Trade Date: 2026-06-18 (CLOSED) \n17:00 Trade Date: 2026-06-18 (OPEN)"
            },
            {
                "date": "06/18/2026",
                "raw_text": "16:00 Trade Date: 2026-06-18 (CLOSED) \n16:45 Trade Date: 2026-06-22 (CLOSED) \n17:00 Trade Date: 2026-06-22 (OPEN)"
            },
            {
                "date": "06/19/2026",
                "raw_text": "12:00 Trade Date: 2026-06-22 (CLOSED)"
            }
        ],
        [
            {
                "date": "07/02/2026",
                "raw_text": "16:00 Trade Date: 2026-07-02 (CLOSED) \n16:45 Trade Date: 2026-07-06 (CLOSED) \n17:00 Trade Date: 2026-07-06 (OPEN)"
            },
            {
                "date": "07/03/2026",
                "raw_text": "12:00 Trade Date: 2026-07-06 (CLOSED)"
            },
            {
                "date": "07/04/2026",
                "raw_text": "CLOSED ALL DAY"
            }
        ],
        [
            {
                "date": "09/06/2026",
                "raw_text": "16:00 Trade Date: 2026-09-08 (CLOSED) \n17:00 Trade Date: 2026-09-08 (OPEN)"
            },
            {
                "date": "09/07/2026",
                "raw_text": "12:00 Trade Date: 2026-09-08 (CLOSED) \n17:00 Trade Date: 2026-09-08 (OPEN)"
            },
            {
                "date": "09/08/2026",
                "raw_text": "16:00 Trade Date: 2026-09-08 (CLOSED) \n16:45 Trade Date: 2026-09-09 (CLOSED) \n17:00 Trade Date: 2026-09-09 (OPEN)"
            }
        ],
        [
            {
                "date": "11/25/2026",
                "raw_text": "16:00 Trade Date: 2026-11-25 (CLOSED) \n16:45 Trade Date: 2026-11-27 (CLOSED) \n17:00 Trade Date: 2026-11-27 (OPEN)"
            },
            {
                "date": "11/26/2026",
                "raw_text": "12:00 Trade Date: 2026-11-27 (CLOSED) \n17:00 Trade Date: 2026-11-27 (OPEN)"
            },
            {
                "date": "11/27/2026",
                "raw_text": "12:15 Trade Date: 2026-11-27 (CLOSED)"
            }
        ],
        [
            {
                "date": "12/23/2026",
                "raw_text": "16:00 Trade Date: 2026-12-23 (CLOSED) \n16:45 Trade Date: 2026-12-24 (CLOSED) \n17:00 Trade Date: 2026-12-24 (OPEN)"
            },
            {
                "date": "12/24/2026",
                "raw_text": "12:15 Trade Date: 2026-12-24 (CLOSED)"
            },
            {
                "date": "12/25/2026",
                "raw_text": "CLOSED ALL DAY"
            }
        ],
        [
            {
                "date": "12/30/2026",
                "raw_text": "16:00 Trade Date: 2026-12-30 (CLOSED) \n16:45 Trade Date: 2026-12-31 (CLOSED) \n17:00 Trade Date: 2026-12-31 (OPEN)"
            },
            {
                "date": "12/31/2026",
                "raw_text": "16:00 Trade Date: 2026-12-31 (CLOSED)"
            },
            {
                "date": "01/01/2027",
                "raw_text": "CLOSED ALL DAY"
            }
        ]
    ],
    "Equities": [
        [
            {
                "date": "12/31/2025",
                "raw_text": "16:00 Trade Date: 2025-12-31 (CLOSED)"
            },
            {
                "date": "01/01/2026",
                "raw_text": "16:00 Trade Date: 2026-01-02 (CLOSED) \n17:00 Trade Date: 2026-01-02 (OPEN)"
            },
            {
                "date": "01/02/2026",
                "raw_text": "16:00 Trade Date: 2026-01-02 (CLOSED)"
            }
        ],
        [
            {
                "date": "01/18/2026",
                "raw_text": "16:00 Trade Date: 2026-01-20 (CLOSED) \n17:00 Trade Date: 2026-01-20 (OPEN)"
            },
            {
                "date": "01/19/2026",
                "raw_text": "12:00 Trade Date: 2026-01-20 (CLOSED) \n17:00 Trade Date: 2026-01-20 (OPEN)"
            },
            {
                "date": "01/20/2026",
                "raw_text": "16:00 Trade Date: 2026-01-20 (CLOSED) \n16:45 Trade Date: 2026-01-21 (CLOSED) \n17:00 Trade Date: 2026-01-21 (OPEN)"
            }
        ],
        [
            {
                "date": "02/15/2026",
                "raw_text": "16:00 Trade Date: 2026-02-17 (CLOSED) \n17:00 Trade Date: 2026-02-17 (OPEN)"
            },
            {
                "date": "02/16/2026",
                "raw_text": "12:00 Trade Date: 2026-02-17 (CLOSED) \n17:00 Trade Date: 2026-02-17 (OPEN)"
            },
            {
                "date": "02/17/2026",
                "raw_text": "16:00 Trade Date: 2026-02-17 (CLOSED) \n16:45 Trade Date: 2026-02-18 (CLOSED) \n17:00 Trade Date: 2026-02-18 (OPEN)"
            }
        ],
        [
            {
                "date": "04/01/2026",
                "raw_text": "16:00 Trade Date: 2026-04-01 (CLOSED) \n16:45 Trade Date: 2026-04-02 (CLOSED) \n17:00 Trade Date: 2026-04-02 (OPEN)"
            },
            {
                "date": "04/02/2026",
                "raw_text": "16:00 Trade Date: 2026-04-02 (CLOSED) \n16:45 Trade Date: 2026-04-03 (CLOSED) \n17:00 Trade Date: 2026-04-03 (OPEN)"
            },
            {
                "date": "04/03/2026",
                "raw_text": "08:15 Trade Date: 2026-04-03 (CLOSED)"
            }
        ],
        [
            {
                "date": "05/24/2026",
                "raw_text": "16:00 Trade Date: 2026-05-26 (CLOSED) \n17:00 Trade Date: 2026-05-26 (OPEN)"
            },
            {
                "date": "05/25/2026",
                "raw_text": "12:00 Trade Date: 2026-05-26 (CLOSED) \n17:00 Trade Date: 2026-05-26 (OPEN)"
            },
            {
                "date": "05/26/2026",
                "raw_text": "16:00 Trade Date: 2026-05-26 (CLOSED) \n16:45 Trade Date: 2026-05-27 (CLOSED) \n17:00 Trade Date: 2026-05-27 (OPEN)"
            }
        ],
        [
            {
                "date": "06/17/2026",
                "raw_text": "16:00 Trade Date: 2026-06-17 (CLOSED) \n16:45 Trade Date: 2026-06-18 (CLOSED) \n17:00 Trade Date: 2026-06-18 (OPEN)"
            },
            {
                "date": "06/18/2026",
                "raw_text": "16:00 Trade Date: 2026-06-18 (CLOSED) \n16:45 Trade Date: 2026-06-22 (CLOSED) \n17:00 Trade Date: 2026-06-22 (OPEN)"
            },
            {
                "date": "06/19/2026",
                "raw_text": "12:00 Trade Date: 2026-06-22 (CLOSED)"
            }
        ],
        [
            {
                "date": "07/02/2026",
                "raw_text": "16:00 Trade Date: 2026-07-02 (CLOSED) \n16:45 Trade Date: 2026-07-06 (CLOSED) \n17:00 Trade Date: 2026-07-06 (OPEN)"
            },
            {
                "date": "07/03/2026",
                "raw_text": "12:00 Trade Date: 2026-07-06 (CLOSED)"
            },
            {
                "date": "07/04/2026",
                "raw_text": "CLOSED ALL DAY"
            }
        ],
        [
            {
                "date": "09/06/2026",
                "raw_text": "16:00 Trade Date: 2026-09-08 (CLOSED) \n17:00 Trade Date: 2026-09-08 (OPEN)"
            },
            {
                "date": "09/07/2026",
                "raw_text": "12:00 Trade Date: 2026-09-08 (CLOSED) \n17:00 Trade Date: 2026-09-08 (OPEN)"
            },
            {
                "date": "09/08/2026",
                "raw_text": "16:00 Trade Date: 2026-09-08 (CLOSED) \n16:45 Trade Date: 2026-09-09 (CLOSED) \n17:00 Trade Date: 2026-09-09 (OPEN)"
            }
        ],
        [
            {
                "date": "11/25/2026",
                "raw_text": "16:00 Trade Date: 2026-11-25 (CLOSED) \n16:45 Trade Date: 2026-11-27 (CLOSED) \n17:00 Trade Date: 2026-11-27 (OPEN)"
            },
            {
                "date": "11/26/2026",
                "raw_text": "12:00 Trade Date: 2026-11-27 (CLOSED) \n17:00 Trade Date: 2026-11-27 (OPEN)"
            },
            {
                "date": "11/27/2026",
                "raw_text": "12:15 Trade Date: 2026-11-27 (CLOSED)"
            }
        ],
        [
            {
                "date": "12/23/2026",
                "raw_text": "16:00 Trade Date: 2026-12-23 (CLOSED) \n16:45 Trade Date: 2026-12-24 (CLOSED) \n17:00 Trade Date: 2026-12-24 (OPEN)"
            },
            {
                "date": "12/24/2026",
                "raw_text": "12:15 Trade Date: 2026-12-24 (CLOSED)"
            },
            {
                "date": "12/25/2026",
                "raw_text": "CLOSED ALL DAY"
            }
        ],
        [
            {
                "date": "12/30/2026",
                "raw_text": "16:00 Trade Date: 2026-12-30 (CLOSED) \n16:45 Trade Date: 2026-12-31 (CLOSED) \n17:00 Trade Date: 2026-12-31 (OPEN)"
            },
            {
                "date": "12/31/2026",
                "raw_text": "16:00 Trade Date: 2026-12-31 (CLOSED)"
            },
            {
                "date": "01/01/2027",
                "raw_text": "CLOSED ALL DAY"
            }
        ]
    ],
    "Energy": [
        [
            {
                "date": "12/31/2025",
                "raw_text": "16:00 Trade Date: 2025-12-31 (CLOSED)"
            },
            {
                "date": "01/01/2026",
                "raw_text": "16:00 Trade Date: 2026-01-02 (CLOSED) \n17:00 Trade Date: 2026-01-02 (OPEN)"
            },
            {
                "date": "01/02/2026",
                "raw_text": "16:00 Trade Date: 2026-01-02 (CLOSED)"
            }
        ],
        [
            {
                "date": "01/18/2026",
                "raw_text": "16:00 Trade Date: 2026-01-20 (CLOSED) \n17:00 Trade Date: 2026-01-20 (OPEN)"
            },
            {
                "date": "01/19/2026",
                "raw_text": "13:30 Trade Date: 2026-01-20 (CLOSED) \n17:00 Trade Date: 2026-01-20 (OPEN)"
            },
            {
                "date": "01/20/2026",
                "raw_text": "16:00 Trade Date: 2026-01-20 (CLOSED) \n16:45 Trade Date: 2026-01-21 (CLOSED) \n17:00 Trade Date: 2026-01-21 (OPEN)"
            }
        ],
        [
            {
                "date": "02/15/2026",
                "raw_text": "16:00 Trade Date: 2026-02-17 (CLOSED) \n17:00 Trade Date: 2026-02-17 (OPEN)"
            },
            {
                "date": "02/16/2026",
                "raw_text": "13:30 Trade Date: 2026-02-17 (CLOSED) \n17:00 Trade Date: 2026-02-17 (OPEN)"
            },
            {
                "date": "02/17/2026",
                "raw_text": "16:00 Trade Date: 2026-02-17 (CLOSED) \n16:45 Trade Date: 2026-02-18 (CLOSED) \n17:00 Trade Date: 2026-02-18 (OPEN)"
            }
        ],
        [
            {
                "date": "04/01/2026",
                "raw_text": "16:00 Trade Date: 2026-04-01 (CLOSED) \n16:45 Trade Date: 2026-04-02 (CLOSED) \n17:00 Trade Date: 2026-04-02 (OPEN)"
            },
            {
                "date": "04/02/2026",
                "raw_text": "16:00 Trade Date: 2026-04-02 (CLOSED)"
            },
            {
                "date": "04/03/2026",
                "raw_text": "CLOSED ALL DAY"
            }
        ],
        [
            {
                "date": "05/24/2026",
                "raw_text": "16:00 Trade Date: 2026-05-26 (CLOSED) \n17:00 Trade Date: 2026-05-26 (OPEN)"
            },
            {
                "date": "05/25/2026",
                "raw_text": "13:30 Trade Date: 2026-05-26 (CLOSED) \n17:00 Trade Date: 2026-05-26 (OPEN)"
            },
            {
                "date": "05/26/2026",
                "raw_text": "16:00 Trade Date: 2026-05-26 (CLOSED) \n16:45 Trade Date: 2026-05-27 (CLOSED) \n17:00 Trade Date: 2026-05-27 (OPEN)"
            }
        ],
        [
            {
                "date": "06/17/2026",
                "raw_text": "16:00 Trade Date: 2026-06-17 (CLOSED) \n16:45 Trade Date: 2026-06-18 (CLOSED) \n17:00 Trade Date: 2026-06-18 (OPEN)"
            },
            {
                "date": "06/18/2026",
                "raw_text": "16:00 Trade Date: 2026-06-18 (CLOSED) \n16:45 Trade Date: 2026-06-22 (CLOSED) \n17:00 Trade Date: 2026-06-22 (OPEN)"
            },
            {
                "date": "06/19/2026",
                "raw_text": "12:00 Trade Date: 2026-06-22 (CLOSED)"
            }
        ],
        [
            {
                "date": "07/02/2026",
                "raw_text": "16:00 Trade Date: 2026-07-02 (CLOSED) \n16:45 Trade Date: 2026-07-06 (CLOSED) \n17:00 Trade Date: 2026-07-06 (OPEN)"
            },
            {
                "date": "07/03/2026",
                "raw_text": "12:00 Trade Date: 2026-07-06 (CLOSED)"
            },
            {
                "date": "07/04/2026",
                "raw_text": "CLOSED ALL DAY"
            }
        ],
        [
            {
                "date": "09/06/2026",
                "raw_text": "16:00 Trade Date: 2026-09-08 (CLOSED) \n17:00 Trade Date: 2026-09-08 (OPEN)"
            },
            {
                "date": "09/07/2026",
                "raw_text": "13:30 Trade Date: 2026-09-08 (CLOSED) \n17:00 Trade Date: 2026-09-08 (OPEN)"
            },
            {
                "date": "09/08/2026",
                "raw_text": "16:00 Trade Date: 2026-09-08 (CLOSED) \n16:45 Trade Date: 2026-09-09 (CLOSED) \n17:00 Trade Date: 2026-09-09 (OPEN)"
            }
        ],
        [
            {
                "date": "11/25/2026",
                "raw_text": "16:00 Trade Date: 2026-11-25 (CLOSED) \n16:45 Trade Date: 2026-11-27 (CLOSED) \n17:00 Trade Date: 2026-11-27 (OPEN)"
            },
            {
                "date": "11/26/2026",
                "raw_text": "13:30 Trade Date: 2026-11-27 (CLOSED) \n17:00 Trade Date: 2026-11-27 (OPEN)"
            },
            {
                "date": "11/27/2026",
                "raw_text": "13:45 Trade Date: 2026-11-27 (CLOSED)"
            }
        ],
        [
            {
                "date": "12/23/2026",
                "raw_text": "16:00 Trade Date: 2026-12-23 (CLOSED) \n16:45 Trade Date: 2026-12-24 (CLOSED) \n17:00 Trade Date: 2026-12-24 (OPEN)"
            },
            {
                "date": "12/24/2026",
                "raw_text": "12:45 Trade Date: 2026-12-24 (CLOSED)"
            },
            {
                "date": "12/25/2026",
                "raw_text": "CLOSED ALL DAY"
            }
        ],
        [
            {
                "date": "12/30/2026",
                "raw_text": "16:00 Trade Date: 2026-12-30 (CLOSED) \n16:45 Trade Date: 2026-12-31 (CLOSED) \n17:00 Trade Date: 2026-12-31 (OPEN)"
            },
            {
                "date": "12/31/2026",
                "raw_text": "16:00 Trade Date: 2026-12-31 (CLOSED)"
            },
            {
                "date": "01/01/2027",
                "raw_text": "CLOSED ALL DAY"
            }
        ]
    ],
    "Grains": [
        [
            {
                "date": "12/31/2025",
                "raw_text": "07:45 Trade Date: 2025-12-31 (PAUSED) \n08:00 Trade Date: 2025-12-31 (CLOSED) \n08:30 Trade Date: 2025-12-31 (OPEN) \n13:20 Trade Date: 2025-12-31 (PAUSED) \n13:30 Trade Date: 2025-12-31 (CLOSED) \n14:30 Trade Date: 2025-12-31 (PCP) \n16:00 Trade Date: 2025-12-31 (CLOSED)"
            },
            {
                "date": "01/01/2026",
                "raw_text": "CLOSED ALL DAY"
            },
            {
                "date": "01/02/2026",
                "raw_text": "06:00 Trade Date: 2026-01-02 (CLOSED) \n08:30 Trade Date: 2026-01-02 (OPEN) \n13:20 Trade Date: 2026-01-02 (PAUSED) \n13:30 Trade Date: 2026-01-02 (CLOSED) \n14:30 Trade Date: 2026-01-02 (PCP) \n16:00 Trade Date: 2026-01-02 (CLOSED)"
            }
        ],
        [
            {
                "date": "01/18/2026",
                "raw_text": "16:00 Trade Date: 2026-01-20 (CLOSED)"
            },
            {
                "date": "01/19/2026",
                "raw_text": "19:00 Trade Date: 2026-01-20 (OPEN)"
            },
            {
                "date": "01/20/2026",
                "raw_text": "07:45 Trade Date: 2026-01-20 (PAUSED) \n08:00 Trade Date: 2026-01-20 (CLOSED) \n08:30 Trade Date: 2026-01-20 (OPEN) \n13:20 Trade Date: 2026-01-20 (PAUSED) \n13:30 Trade Date: 2026-01-20 (CLOSED) \n14:30 Trade Date: 2026-01-20 (PCP) \n16:00 Trade Date: 2026-01-20 (CLOSED) \n16:45 Trade Date: 2026-01-21 (CLOSED) \n19:00 Trade Date: 2026-01-21 (OPEN)"
            }
        ],
        [
            {
                "date": "02/15/2026",
                "raw_text": "16:00 Trade Date: 2026-02-17 (CLOSED)"
            },
            {
                "date": "02/16/2026",
                "raw_text": "19:00 Trade Date: 2026-02-17 (OPEN)"
            },
            {
                "date": "02/17/2026",
                "raw_text": "07:45 Trade Date: 2026-02-17 (PAUSED) \n08:00 Trade Date: 2026-02-17 (CLOSED) \n08:30 Trade Date: 2026-02-17 (OPEN) \n13:20 Trade Date: 2026-02-17 (PAUSED) \n13:30 Trade Date: 2026-02-17 (CLOSED) \n14:30 Trade Date: 2026-02-17 (PCP) \n16:00 Trade Date: 2026-02-17 (CLOSED) \n16:45 Trade Date: 2026-02-18 (CLOSED) \n19:00 Trade Date: 2026-02-18 (OPEN)"
            }
        ],
        [
            {
                "date": "04/01/2026",
                "raw_text": "07:45 Trade Date: 2026-04-01 (PAUSED) \n08:00 Trade Date: 2026-04-01 (CLOSED) \n08:30 Trade Date: 2026-04-01 (OPEN) \n13:20 Trade Date: 2026-04-01 (PAUSED) \n13:30 Trade Date: 2026-04-01 (CLOSED) \n14:30 Trade Date: 2026-04-01 (PCP) \n16:00 Trade Date: 2026-04-01 (CLOSED) \n16:45 Trade Date: 2026-04-02 (CLOSED) \n19:00 Trade Date: 2026-04-02 (OPEN)"
            },
            {
                "date": "04/02/2026",
                "raw_text": "07:45 Trade Date: 2026-04-02 (PAUSED) \n08:00 Trade Date: 2026-04-02 (CLOSED) \n08:30 Trade Date: 2026-04-02 (OPEN) \n13:20 Trade Date: 2026-04-02 (PAUSED) \n13:30 Trade Date: 2026-04-02 (CLOSED) \n14:30 Trade Date: 2026-04-02 (PCP) \n16:00 Trade Date: 2026-04-02 (CLOSED)"
            },
            {
                "date": "04/03/2026",
                "raw_text": "CLOSED ALL DAY"
            }
        ],
        [
            {
                "date": "05/24/2026",
                "raw_text": "16:00 Trade Date: 2026-05-26 (CLOSED)"
            },
            {
                "date": "05/25/2026",
                "raw_text": "19:00 Trade Date: 2026-05-26 (OPEN)"
            },
            {
                "date": "05/26/2026",
                "raw_text": "07:45 Trade Date: 2026-05-26 (PAUSED) \n08:00 Trade Date: 2026-05-26 (CLOSED) \n08:30 Trade Date: 2026-05-26 (OPEN) \n13:20 Trade Date: 2026-05-26 (PAUSED) \n13:30 Trade Date: 2026-05-26 (CLOSED) \n14:30 Trade Date: 2026-05-26 (PCP) \n16:00 Trade Date: 2026-05-26 (CLOSED) \n16:45 Trade Date: 2026-05-27 (CLOSED) \n19:00 Trade Date: 2026-05-27 (OPEN)"
            }
        ],
        [
            {
                "date": "06/17/2026",
                "raw_text": "07:45 Trade Date: 2026-06-17 (PAUSED) \n08:00 Trade Date: 2026-06-17 (CLOSED) \n08:30 Trade Date: 2026-06-17 (OPEN) \n13:20 Trade Date: 2026-06-17 (PAUSED) \n13:30 Trade Date: 2026-06-17 (CLOSED) \n14:30 Trade Date: 2026-06-17 (PCP) \n16:00 Trade Date: 2026-06-17 (CLOSED) \n16:45 Trade Date: 2026-06-18 (CLOSED) \n19:00 Trade Date: 2026-06-18 (OPEN)"
            },
            {
                "date": "06/18/2026",
                "raw_text": "07:45 Trade Date: 2026-06-18 (PAUSED) \n08:00 Trade Date: 2026-06-18 (CLOSED) \n08:30 Trade Date: 2026-06-18 (OPEN) \n13:20 Trade Date: 2026-06-18 (PAUSED) \n13:30 Trade Date: 2026-06-18 (CLOSED) \n14:30 Trade Date: 2026-06-18 (PCP) \n16:00 Trade Date: 2026-06-18 (CLOSED)"
            },
            {
                "date": "06/19/2026",
                "raw_text": "CLOSED ALL DAY"
            }
        ],
        [
            {
                "date": "07/02/2026",
                "raw_text": "07:45 Trade Date: 2026-07-02 (PAUSED) \n08:00 Trade Date: 2026-07-02 (CLOSED) \n08:30 Trade Date: 2026-07-02 (OPEN) \n13:20 Trade Date: 2026-07-02 (PAUSED) \n13:30 Trade Date: 2026-07-02 (CLOSED) \n14:30 Trade Date: 2026-07-02 (PCP) \n16:00 Trade Date: 2026-07-02 (CLOSED)"
            },
            {
                "date": "07/03/2026",
                "raw_text": "CLOSED ALL DAY"
            },
            {
                "date": "07/04/2026",
                "raw_text": "CLOSED ALL DAY"
            }
        ],
        [
            {
                "date": "09/06/2026",
                "raw_text": "16:00 Trade Date: 2026-09-08 (CLOSED)"
            },
            {
                "date": "09/07/2026",
                "raw_text": "19:00 Trade Date: 2026-09-08 (OPEN)"
            },
            {
                "date": "09/08/2026",
                "raw_text": "07:45 Trade Date: 2026-09-08 (PAUSED) \n08:00 Trade Date: 2026-09-08 (CLOSED) \n08:30 Trade Date: 2026-09-08 (OPEN) \n13:20 Trade Date: 2026-09-08 (PAUSED) \n13:30 Trade Date: 2026-09-08 (CLOSED) \n14:30 Trade Date: 2026-09-08 (PCP) \n16:00 Trade Date: 2026-09-08 (CLOSED) \n16:45 Trade Date: 2026-09-09 (CLOSED) \n19:00 Trade Date: 2026-09-09 (OPEN)"
            }
        ],
        [
            {
                "date": "11/25/2026",
                "raw_text": "07:45 Trade Date: 2026-11-25 (PAUSED) \n08:00 Trade Date: 2026-11-25 (CLOSED) \n08:30 Trade Date: 2026-11-25 (OPEN) \n13:20 Trade Date: 2026-11-25 (PAUSED) \n13:30 Trade Date: 2026-11-25 (CLOSED) \n14:30 Trade Date: 2026-11-25 (PCP) \n16:00 Trade Date: 2026-11-25 (CLOSED) \n16:45 Trade Date: 2026-11-27 (CLOSED)"
            },
            {
                "date": "11/26/2026",
                "raw_text": "CLOSED ALL DAY"
            },
            {
                "date": "11/27/2026",
                "raw_text": "08:30 Trade Date: 2026-11-27 (OPEN) \n12:05 Trade Date: 2026-11-27 (CLOSED)"
            }
        ],
        [
            {
                "date": "12/23/2026",
                "raw_text": "07:45 Trade Date: 2026-12-23 (PAUSED) \n08:00 Trade Date: 2026-12-23 (CLOSED) \n08:30 Trade Date: 2026-12-23 (OPEN) \n13:20 Trade Date: 2026-12-23 (PAUSED) \n13:30 Trade Date: 2026-12-23 (CLOSED) \n14:30 Trade Date: 2026-12-23 (PCP) \n16:00 Trade Date: 2026-12-23 (CLOSED) \n16:45 Trade Date: 2026-12-24 (CLOSED) \n19:00 Trade Date: 2026-12-24 (OPEN)"
            },
            {
                "date": "12/24/2026",
                "raw_text": "07:45 Trade Date: 2026-12-24 (PAUSED) \n08:00 Trade Date: 2026-12-24 (CLOSED) \n08:30 Trade Date: 2026-12-24 (OPEN) \n12:05 Trade Date: 2026-12-24 (CLOSED)"
            },
            {
                "date": "12/25/2026",
                "raw_text": "CLOSED ALL DAY"
            }
        ],
        [
            {
                "date": "12/30/2026",
                "raw_text": "07:45 Trade Date: 2026-12-30 (PAUSED) \n08:00 Trade Date: 2026-12-30 (CLOSED) \n08:30 Trade Date: 2026-12-30 (OPEN) \n13:20 Trade Date: 2026-12-30 (PAUSED) \n13:30 Trade Date: 2026-12-30 (CLOSED) \n14:30 Trade Date: 2026-12-30 (PCP) \n16:00 Trade Date: 2026-12-30 (CLOSED) \n16:45 Trade Date: 2026-12-31 (CLOSED) \n19:00 Trade Date: 2026-12-31 (OPEN)"
            },
            {
                "date": "12/31/2026",
                "raw_text": "07:45 Trade Date: 2026-12-31 (PAUSED) \n08:00 Trade Date: 2026-12-31 (CLOSED) \n08:30 Trade Date: 2026-12-31 (OPEN) \n13:20 Trade Date: 2026-12-31 (PAUSED) \n13:30 Trade Date: 2026-12-31 (CLOSED) \n14:30 Trade Date: 2026-12-31 (PCP) \n16:00 Trade Date: 2026-12-31 (CLOSED)"
            },
            {
                "date": "01/01/2027",
                "raw_text": "CLOSED ALL DAY"
            }
        ]
    ],
    "FX": [
        [
            {
                "date": "12/31/2025",
                "raw_text": "16:00 Trade Date: 2025-12-31 (CLOSED)"
            },
            {
                "date": "01/01/2026",
                "raw_text": "16:00 Trade Date: 2026-01-02 (CLOSED) \n17:00 Trade Date: 2026-01-02 (OPEN)"
            },
            {
                "date": "01/02/2026",
                "raw_text": "16:00 Trade Date: 2026-01-02 (CLOSED)"
            }
        ],
        [
            {
                "date": "01/18/2026",
                "raw_text": "16:00 Trade Date: 2026-01-20 (CLOSED) \n17:00 Trade Date: 2026-01-20 (OPEN)"
            },
            {
                "date": "01/19/2026",
                "raw_text": "16:00 Trade Date: 2026-01-20 (CLOSED) \n17:00 Trade Date: 2026-01-20 (OPEN)"
            },
            {
                "date": "01/20/2026",
                "raw_text": "16:00 Trade Date: 2026-01-20 (CLOSED) \n16:45 Trade Date: 2026-01-21 (CLOSED) \n17:00 Trade Date: 2026-01-21 (OPEN)"
            }
        ],
        [
            {
                "date": "02/15/2026",
                "raw_text": "16:00 Trade Date: 2026-02-17 (CLOSED) \n17:00 Trade Date: 2026-02-17 (OPEN)"
            },
            {
                "date": "02/16/2026",
                "raw_text": "16:00 Trade Date: 2026-02-17 (CLOSED) \n17:00 Trade Date: 2026-02-17 (OPEN)"
            },
            {
                "date": "02/17/2026",
                "raw_text": "16:00 Trade Date: 2026-02-17 (CLOSED) \n16:45 Trade Date: 2026-02-18 (CLOSED) \n17:00 Trade Date: 2026-02-18 (OPEN)"
            }
        ],
        [
            {
                "date": "04/01/2026",
                "raw_text": "16:00 Trade Date: 2026-04-01 (CLOSED) \n16:45 Trade Date: 2026-04-02 (CLOSED) \n17:00 Trade Date: 2026-04-02 (OPEN)"
            },
            {
                "date": "04/02/2026",
                "raw_text": "16:00 Trade Date: 2026-04-02 (CLOSED) \n16:45 Trade Date: 2026-04-03 (CLOSED) \n17:00 Trade Date: 2026-04-03 (OPEN)"
            },
            {
                "date": "04/03/2026",
                "raw_text": "10:15 Trade Date: 2026-04-03 (CLOSED)"
            }
        ],
        [
            {
                "date": "05/24/2026",
                "raw_text": "16:00 Trade Date: 2026-05-26 (CLOSED) \n17:00 Trade Date: 2026-05-26 (OPEN)"
            },
            {
                "date": "05/25/2026",
                "raw_text": "16:00 Trade Date: 2026-05-26 (CLOSED) \n17:00 Trade Date: 2026-05-26 (OPEN)"
            },
            {
                "date": "05/26/2026",
                "raw_text": "16:00 Trade Date: 2026-05-26 (CLOSED) \n16:45 Trade Date: 2026-05-27 (CLOSED) \n17:00 Trade Date: 2026-05-27 (OPEN)"
            }
        ],
        [
            {
                "date": "06/17/2026",
                "raw_text": "16:00 Trade Date: 2026-06-17 (CLOSED) \n16:45 Trade Date: 2026-06-18 (CLOSED) \n17:00 Trade Date: 2026-06-18 (OPEN)"
            },
            {
                "date": "06/18/2026",
                "raw_text": "16:00 Trade Date: 2026-06-18 (CLOSED) \n16:45 Trade Date: 2026-06-22 (CLOSED) \n17:00 Trade Date: 2026-06-22 (OPEN)"
            },
            {
                "date": "06/19/2026",
                "raw_text": "12:00 Trade Date: 2026-06-22 (CLOSED)"
            }
        ],
        [
            {
                "date": "07/02/2026",
                "raw_text": "16:00 Trade Date: 2026-07-02 (CLOSED) \n16:45 Trade Date: 2026-07-06 (CLOSED) \n17:00 Trade Date: 2026-07-06 (OPEN)"
            },
            {
                "date": "07/03/2026",
                "raw_text": "12:00 Trade Date: 2026-07-06 (CLOSED)"
            },
            {
                "date": "07/04/2026",
                "raw_text": "CLOSED ALL DAY"
            }
        ],
        [
            {
                "date": "09/06/2026",
                "raw_text": "16:00 Trade Date: 2026-09-08 (CLOSED) \n17:00 Trade Date: 2026-09-08 (OPEN)"
            },
            {
                "date": "09/07/2026",
                "raw_text": "16:00 Trade Date: 2026-09-08 (CLOSED) \n17:00 Trade Date: 2026-09-08 (OPEN)"
            },
            {
                "date": "09/08/2026",
                "raw_text": "16:00 Trade Date: 2026-09-08 (CLOSED) \n16:45 Trade Date: 2026-09-09 (CLOSED) \n17:00 Trade Date: 2026-09-09 (OPEN)"
            }
        ],
        [
            {
                "date": "11/25/2026",
                "raw_text": "16:00 Trade Date: 2026-11-25 (CLOSED) \n16:45 Trade Date: 2026-11-27 (CLOSED) \n17:00 Trade Date: 2026-11-27 (OPEN)"
            },
            {
                "date": "11/26/2026",
                "raw_text": "16:00 Trade Date: 2026-11-27 (CLOSED) \n17:00 Trade Date: 2026-11-27 (OPEN)"
            },
            {
                "date": "11/27/2026",
                "raw_text": "13:45 Trade Date: 2026-11-27 (CLOSED)"
            }
        ],
        [
            {
                "date": "12/23/2026",
                "raw_text": "16:00 Trade Date: 2026-12-23 (CLOSED) \n16:45 Trade Date: 2026-12-24 (CLOSED) \n17:00 Trade Date: 2026-12-24 (OPEN)"
            },
            {
                "date": "12/24/2026",
                "raw_text": "12:45 Trade Date: 2026-12-24 (CLOSED)"
            },
            {
                "date": "12/25/2026",
                "raw_text": "CLOSED ALL DAY"
            }
        ],
        [
            {
                "date": "12/30/2026",
                "raw_text": "16:00 Trade Date: 2026-12-30 (CLOSED) \n16:45 Trade Date: 2026-12-31 (CLOSED) \n17:00 Trade Date: 2026-12-31 (OPEN)"
            },
            {
                "date": "12/31/2026",
                "raw_text": "16:00 Trade Date: 2026-12-31 (CLOSED)"
            },
            {
                "date": "01/01/2027",
                "raw_text": "CLOSED ALL DAY"
            }
        ]
    ],
    "Metals": [
        [
            {
                "date": "12/31/2025",
                "raw_text": "16:00 Trade Date: 2025-12-31 (CLOSED)"
            },
            {
                "date": "01/01/2026",
                "raw_text": "16:00 Trade Date: 2026-01-02 (CLOSED) \n17:00 Trade Date: 2026-01-02 (OPEN)"
            },
            {
                "date": "01/02/2026",
                "raw_text": "16:00 Trade Date: 2026-01-02 (CLOSED)"
            }
        ],
        [
            {
                "date": "01/18/2026",
                "raw_text": "16:00 Trade Date: 2026-01-20 (CLOSED) \n17:00 Trade Date: 2026-01-20 (OPEN)"
            },
            {
                "date": "01/19/2026",
                "raw_text": "13:30 Trade Date: 2026-01-20 (CLOSED) \n17:00 Trade Date: 2026-01-20 (OPEN)"
            },
            {
                "date": "01/20/2026",
                "raw_text": "16:00 Trade Date: 2026-01-20 (CLOSED) \n16:45 Trade Date: 2026-01-21 (CLOSED) \n17:00 Trade Date: 2026-01-21 (OPEN)"
            }
        ],
        [
            {
                "date": "02/15/2026",
                "raw_text": "16:00 Trade Date: 2026-02-17 (CLOSED) \n17:00 Trade Date: 2026-02-17 (OPEN)"
            },
            {
                "date": "02/16/2026",
                "raw_text": "13:30 Trade Date: 2026-02-17 (CLOSED) \n17:00 Trade Date: 2026-02-17 (OPEN)"
            },
            {
                "date": "02/17/2026",
                "raw_text": "16:00 Trade Date: 2026-02-17 (CLOSED) \n16:45 Trade Date: 2026-02-18 (CLOSED) \n17:00 Trade Date: 2026-02-18 (OPEN)"
            }
        ],
        [
            {
                "date": "04/01/2026",
                "raw_text": "16:00 Trade Date: 2026-04-01 (CLOSED) \n16:45 Trade Date: 2026-04-02 (CLOSED) \n17:00 Trade Date: 2026-04-02 (OPEN)"
            },
            {
                "date": "04/02/2026",
                "raw_text": "16:00 Trade Date: 2026-04-02 (CLOSED)"
            },
            {
                "date": "04/03/2026",
                "raw_text": "CLOSED ALL DAY"
            }
        ],
        [
            {
                "date": "05/24/2026",
                "raw_text": "16:00 Trade Date: 2026-05-26 (CLOSED) \n17:00 Trade Date: 2026-05-26 (OPEN)"
            },
            {
                "date": "05/25/2026",
                "raw_text": "13:30 Trade Date: 2026-05-26 (CLOSED) \n17:00 Trade Date: 2026-05-26 (OPEN)"
            },
            {
                "date": "05/26/2026",
                "raw_text": "16:00 Trade Date: 2026-05-26 (CLOSED) \n16:45 Trade Date: 2026-05-27 (CLOSED) \n17:00 Trade Date: 2026-05-27 (OPEN)"
            }
        ],
        [
            {
                "date": "06/17/2026",
                "raw_text": "16:00 Trade Date: 2026-06-17 (CLOSED) \n16:45 Trade Date: 2026-06-18 (CLOSED) \n17:00 Trade Date: 2026-06-18 (OPEN)"
            },
            {
                "date": "06/18/2026",
                "raw_text": "16:00 Trade Date: 2026-06-18 (CLOSED) \n16:45 Trade Date: 2026-06-22 (CLOSED) \n17:00 Trade Date: 2026-06-22 (OPEN)"
            },
            {
                "date": "06/19/2026",
                "raw_text": "12:00 Trade Date: 2026-06-22 (CLOSED)"
            }
        ],
        [
            {
                "date": "07/02/2026",
                "raw_text": "16:00 Trade Date: 2026-07-02 (CLOSED) \n16:45 Trade Date: 2026-07-06 (CLOSED) \n17:00 Trade Date: 2026-07-06 (OPEN)"
            },
            {
                "date": "07/03/2026",
                "raw_text": "12:00 Trade Date: 2026-07-06 (CLOSED)"
            },
            {
                "date": "07/04/2026",
                "raw_text": "CLOSED ALL DAY"
            }
        ],
        [
            {
                "date": "09/06/2026",
                "raw_text": "16:00 Trade Date: 2026-09-08 (CLOSED) \n17:00 Trade Date: 2026-09-08 (OPEN)"
            },
            {
                "date": "09/07/2026",
                "raw_text": "13:30 Trade Date: 2026-09-08 (CLOSED) \n17:00 Trade Date: 2026-09-08 (OPEN)"
            },
            {
                "date": "09/08/2026",
                "raw_text": "16:00 Trade Date: 2026-09-08 (CLOSED) \n16:45 Trade Date: 2026-09-09 (CLOSED) \n17:00 Trade Date: 2026-09-09 (OPEN)"
            }
        ],
        [
            {
                "date": "11/25/2026",
                "raw_text": "16:00 Trade Date: 2026-11-25 (CLOSED) \n16:45 Trade Date: 2026-11-27 (CLOSED) \n17:00 Trade Date: 2026-11-27 (OPEN)"
            },
            {
                "date": "11/26/2026",
                "raw_text": "13:30 Trade Date: 2026-11-27 (CLOSED) \n17:00 Trade Date: 2026-11-27 (OPEN)"
            },
            {
                "date": "11/27/2026",
                "raw_text": "13:45 Trade Date: 2026-11-27 (CLOSED)"
            }
        ],
        [
            {
                "date": "12/23/2026",
                "raw_text": "16:00 Trade Date: 2026-12-23 (CLOSED) \n16:45 Trade Date: 2026-12-24 (CLOSED) \n17:00 Trade Date: 2026-12-24 (OPEN)"
            },
            {
                "date": "12/24/2026",
                "raw_text": "12:45 Trade Date: 2026-12-24 (CLOSED)"
            },
            {
                "date": "12/25/2026",
                "raw_text": "CLOSED ALL DAY"
            }
        ],
        [
            {
                "date": "12/30/2026",
                "raw_text": "16:00 Trade Date: 2026-12-30 (CLOSED) \n16:45 Trade Date: 2026-12-31 (CLOSED) \n17:00 Trade Date: 2026-12-31 (OPEN)"
            },
            {
                "date": "12/31/2026",
                "raw_text": "16:00 Trade Date: 2026-12-31 (CLOSED)"
            },
            {
                "date": "01/01/2027",
                "raw_text": "CLOSED ALL DAY"
            }
        ]
    ],
    "Livestock": [
        [
            {
                "date": "12/31/2025",
                "raw_text": "08:00 Trade Date: 2025-12-31 (CLOSED) \n08:30 Trade Date: 2025-12-31 (OPEN) \n13:05 Trade Date: 2025-12-31 (CLOSED) \n14:30 Trade Date: 2025-12-31 (PCP) \n16:00 Trade Date: 2025-12-31 (CLOSED)"
            },
            {
                "date": "01/01/2026",
                "raw_text": "CLOSED ALL DAY"
            },
            {
                "date": "01/02/2026",
                "raw_text": "08:00 Trade Date: 2026-01-02 (CLOSED) \n08:30 Trade Date: 2026-01-02 (OPEN) \n13:05 Trade Date: 2026-01-02 (CLOSED) \n14:30 Trade Date: 2026-01-02 (PCP) \n16:00 Trade Date: 2026-01-02 (CLOSED)"
            }
        ],
        [
            {
                "date": "01/18/2026",
                "raw_text": "CLOSED ALL DAY"
            },
            {
                "date": "01/19/2026",
                "raw_text": "CLOSED ALL DAY"
            },
            {
                "date": "01/20/2026",
                "raw_text": "08:00 Trade Date: 2026-01-20 (CLOSED) \n08:30 Trade Date: 2026-01-20 (OPEN) \n13:05 Trade Date: 2026-01-20 (CLOSED) \n14:30 Trade Date: 2026-01-20 (PCP) \n16:00 Trade Date: 2026-01-20 (CLOSED)"
            }
        ],
        [
            {
                "date": "02/15/2026",
                "raw_text": "CLOSED ALL DAY"
            },
            {
                "date": "02/16/2026",
                "raw_text": "CLOSED ALL DAY"
            },
            {
                "date": "02/17/2026",
                "raw_text": "08:00 Trade Date: 2026-02-17 (CLOSED) \n08:30 Trade Date: 2026-02-17 (OPEN) \n13:05 Trade Date: 2026-02-17 (CLOSED) \n14:30 Trade Date: 2026-02-17 (PCP) \n16:00 Trade Date: 2026-02-17 (CLOSED)"
            }
        ],
        [
            {
                "date": "04/01/2026",
                "raw_text": "08:00 Trade Date: 2026-04-01 (CLOSED) \n08:30 Trade Date: 2026-04-01 (OPEN) \n13:05 Trade Date: 2026-04-01 (CLOSED) \n14:30 Trade Date: 2026-04-01 (PCP) \n16:00 Trade Date: 2026-04-01 (CLOSED)"
            },
            {
                "date": "04/02/2026",
                "raw_text": "08:00 Trade Date: 2026-04-02 (CLOSED) \n08:30 Trade Date: 2026-04-02 (OPEN) \n13:05 Trade Date: 2026-04-02 (CLOSED) \n14:30 Trade Date: 2026-04-02 (PCP) \n16:00 Trade Date: 2026-04-02 (CLOSED)"
            },
            {
                "date": "04/03/2026",
                "raw_text": "CLOSED ALL DAY"
            }
        ],
        [
            {
                "date": "05/24/2026",
                "raw_text": "CLOSED ALL DAY"
            },
            {
                "date": "05/25/2026",
                "raw_text": "CLOSED ALL DAY"
            },
            {
                "date": "05/26/2026",
                "raw_text": "08:00 Trade Date: 2026-05-26 (CLOSED) \n08:30 Trade Date: 2026-05-26 (OPEN) \n13:05 Trade Date: 2026-05-26 (CLOSED) \n14:30 Trade Date: 2026-05-26 (PCP) \n16:00 Trade Date: 2026-05-26 (CLOSED)"
            }
        ],
        [
            {
                "date": "06/17/2026",
                "raw_text": "08:00 Trade Date: 2026-06-17 (CLOSED) \n08:30 Trade Date: 2026-06-17 (OPEN) \n13:05 Trade Date: 2026-06-17 (CLOSED) \n14:30 Trade Date: 2026-06-17 (PCP) \n16:00 Trade Date: 2026-06-17 (CLOSED)"
            },
            {
                "date": "06/18/2026",
                "raw_text": "08:00 Trade Date: 2026-06-18 (CLOSED) \n08:30 Trade Date: 2026-06-18 (OPEN) \n13:05 Trade Date: 2026-06-18 (CLOSED) \n14:30 Trade Date: 2026-06-18 (PCP) \n16:00 Trade Date: 2026-06-18 (CLOSED)"
            },
            {
                "date": "06/19/2026",
                "raw_text": "CLOSED ALL DAY"
            }
        ],
        [
            {
                "date": "07/02/2026",
                "raw_text": "08:00 Trade Date: 2026-07-02 (CLOSED) \n08:30 Trade Date: 2026-07-02 (OPEN) \n13:05 Trade Date: 2026-07-02 (CLOSED) \n14:30 Trade Date: 2026-07-02 (PCP) \n16:00 Trade Date: 2026-07-02 (CLOSED)"
            },
            {
                "date": "07/03/2026",
                "raw_text": "CLOSED ALL DAY"
            },
            {
                "date": "07/04/2026",
                "raw_text": "CLOSED ALL DAY"
            }
        ],
        [
            {
                "date": "09/06/2026",
                "raw_text": "CLOSED ALL DAY"
            },
            {
                "date": "09/07/2026",
                "raw_text": "CLOSED ALL DAY"
            },
            {
                "date": "09/08/2026",
                "raw_text": "08:00 Trade Date: 2026-09-08 (CLOSED) \n08:30 Trade Date: 2026-09-08 (OPEN) \n13:05 Trade Date: 2026-09-08 (CLOSED) \n14:30 Trade Date: 2026-09-08 (PCP) \n16:00 Trade Date: 2026-09-08 (CLOSED)"
            }
        ],
        [
            {
                "date": "11/25/2026",
                "raw_text": "08:00 Trade Date: 2026-11-25 (CLOSED) \n08:30 Trade Date: 2026-11-25 (OPEN) \n13:05 Trade Date: 2026-11-25 (CLOSED) \n14:30 Trade Date: 2026-11-25 (PCP) \n16:00 Trade Date: 2026-11-25 (CLOSED)"
            },
            {
                "date": "11/26/2026",
                "raw_text": "CLOSED ALL DAY"
            },
            {
                "date": "11/27/2026",
                "raw_text": "08:00 Trade Date: 2026-11-27 (CLOSED) \n08:30 Trade Date: 2026-11-27 (OPEN) \n12:05 Trade Date: 2026-11-27 (CLOSED)"
            }
        ],
        [
            {
                "date": "12/23/2026",
                "raw_text": "08:00 Trade Date: 2026-12-23 (CLOSED) \n08:30 Trade Date: 2026-12-23 (OPEN) \n13:05 Trade Date: 2026-12-23 (CLOSED) \n14:30 Trade Date: 2026-12-23 (PCP) \n16:00 Trade Date: 2026-12-23 (CLOSED)"
            },
            {
                "date": "12/24/2026",
                "raw_text": "08:00 Trade Date: 2026-12-24 (CLOSED) \n08:30 Trade Date: 2026-12-24 (OPEN) \n12:15 Trade Date: 2026-12-24 (CLOSED)"
            },
            {
                "date": "12/25/2026",
                "raw_text": "CLOSED ALL DAY"
            }
        ],
        [
            {
                "date": "12/30/2026",
                "raw_text": "08:00 Trade Date: 2026-12-30 (CLOSED) \n08:30 Trade Date: 2026-12-30 (OPEN) \n13:05 Trade Date: 2026-12-30 (CLOSED) \n14:30 Trade Date: 2026-12-30 (PCP) \n16:00 Trade Date: 2026-12-30 (CLOSED)"
            },
            {
                "date": "12/31/2026",
                "raw_text": "08:00 Trade Date: 2026-12-31 (CLOSED) \n08:30 Trade Date: 2026-12-31 (OPEN) \n13:05 Trade Date: 2026-12-31 (CLOSED) \n14:30 Trade Date: 2026-12-31 (PCP) \n16:00 Trade Date: 2026-12-31 (CLOSED)"
            },
            {
                "date": "01/01/2027",
                "raw_text": "CLOSED ALL DAY"
            }
        ]
    ],
    "Dairy": [
        [
            {
                "date": "12/31/2025",
                "raw_text": "16:00 Trade Date: 2025-12-31 (CLOSED)"
            },
            {
                "date": "01/01/2026",
                "raw_text": "16:00 Trade Date: 2026-01-02 (CLOSED) \n17:00 Trade Date: 2026-01-02 (OPEN)"
            },
            {
                "date": "01/02/2026",
                "raw_text": "13:55 Trade Date: 2026-01-02 (CLOSED)"
            }
        ],
        [
            {
                "date": "01/18/2026",
                "raw_text": "16:00 Trade Date: 2026-01-20 (CLOSED)"
            },
            {
                "date": "01/19/2026",
                "raw_text": "17:00 Trade Date: 2026-01-20 (OPEN)"
            },
            {
                "date": "01/20/2026",
                "raw_text": "16:00 Trade Date: 2026-01-20 (CLOSED) \n16:45 Trade Date: 2026-01-21 (CLOSED) \n17:00 Trade Date: 2026-01-21 (OPEN)"
            }
        ],
        [
            {
                "date": "02/15/2026",
                "raw_text": "16:00 Trade Date: 2026-02-17 (CLOSED)"
            },
            {
                "date": "02/16/2026",
                "raw_text": "17:00 Trade Date: 2026-02-17 (OPEN)"
            },
            {
                "date": "02/17/2026",
                "raw_text": "16:00 Trade Date: 2026-02-17 (CLOSED) \n16:45 Trade Date: 2026-02-18 (CLOSED) \n17:00 Trade Date: 2026-02-18 (OPEN)"
            }
        ],
        [
            {
                "date": "04/01/2026",
                "raw_text": "16:00 Trade Date: 2026-04-01 (CLOSED) \n16:45 Trade Date: 2026-04-02 (CLOSED) \n17:00 Trade Date: 2026-04-02 (OPEN)"
            },
            {
                "date": "04/02/2026",
                "raw_text": "13:55 Trade Date: 2026-04-02 (CLOSED)"
            },
            {
                "date": "04/03/2026",
                "raw_text": "CLOSED ALL DAY"
            }
        ],
        [
            {
                "date": "05/24/2026",
                "raw_text": "16:00 Trade Date: 2026-05-26 (CLOSED)"
            },
            {
                "date": "05/25/2026",
                "raw_text": "17:00 Trade Date: 2026-05-26 (OPEN)"
            },
            {
                "date": "05/26/2026",
                "raw_text": "16:00 Trade Date: 2026-05-26 (CLOSED) \n16:45 Trade Date: 2026-05-27 (CLOSED) \n17:00 Trade Date: 2026-05-27 (OPEN)"
            }
        ],
        [
            {
                "date": "06/17/2026",
                "raw_text": "16:00 Trade Date: 2026-06-17 (CLOSED) \n16:45 Trade Date: 2026-06-18 (CLOSED) \n17:00 Trade Date: 2026-06-18 (OPEN)"
            },
            {
                "date": "06/18/2026",
                "raw_text": "13:55 Trade Date: 2026-06-18 (CLOSED)"
            },
            {
                "date": "06/19/2026",
                "raw_text": "CLOSED ALL DAY"
            }
        ],
        [
            {
                "date": "07/02/2026",
                "raw_text": "13:55 Trade Date: 2026-07-02 (CLOSED)"
            },
            {
                "date": "07/03/2026",
                "raw_text": "CLOSED ALL DAY"
            },
            {
                "date": "07/04/2026",
                "raw_text": "CLOSED ALL DAY"
            }
        ],
        [
            {
                "date": "09/06/2026",
                "raw_text": "16:00 Trade Date: 2026-09-08 (CLOSED)"
            },
            {
                "date": "09/07/2026",
                "raw_text": "17:00 Trade Date: 2026-09-08 (OPEN)"
            },
            {
                "date": "09/08/2026",
                "raw_text": "16:00 Trade Date: 2026-09-08 (CLOSED) \n16:45 Trade Date: 2026-09-09 (CLOSED) \n17:00 Trade Date: 2026-09-09 (OPEN)"
            }
        ],
        [
            {
                "date": "11/25/2026",
                "raw_text": "16:00 Trade Date: 2026-11-25 (CLOSED)"
            },
            {
                "date": "11/26/2026",
                "raw_text": "CLOSED ALL DAY"
            },
            {
                "date": "11/27/2026",
                "raw_text": "CLOSED ALL DAY"
            }
        ],
        [
            {
                "date": "12/23/2026",
                "raw_text": "16:00 Trade Date: 2026-12-23 (CLOSED) \n16:45 Trade Date: 2026-12-24 (CLOSED) \n17:00 Trade Date: 2026-12-24 (OPEN)"
            },
            {
                "date": "12/24/2026",
                "raw_text": "12:00 Trade Date: 2026-12-24 (CLOSED)"
            },
            {
                "date": "12/25/2026",
                "raw_text": "CLOSED ALL DAY"
            }
        ],
        [
            {
                "date": "12/30/2026",
                "raw_text": "16:00 Trade Date: 2026-12-30 (CLOSED) \n16:45 Trade Date: 2026-12-31 (CLOSED) \n17:00 Trade Date: 2026-12-31 (OPEN)"
            },
            {
                "date": "12/31/2026",
                "raw_text": "13:55 Trade Date: 2026-12-31 (CLOSED)"
            },
            {
                "date": "01/01/2027",
                "raw_text": "CLOSED ALL DAY"
            }
        ]
    ],
    "Cryptocurrencies": [
        [
            {
                "date": "12/31/2025",
                "raw_text": "16:00 Trade Date: 2025-12-31 (CLOSED)"
            },
            {
                "date": "01/01/2026",
                "raw_text": "16:00 Trade Date: 2026-01-02 (CLOSED) \n17:00 Trade Date: 2026-01-02 (OPEN)"
            },
            {
                "date": "01/02/2026",
                "raw_text": "16:00 Trade Date: 2026-01-02 (CLOSED)"
            }
        ],
        [
            {
                "date": "01/18/2026",
                "raw_text": "16:00 Trade Date: 2026-01-20 (CLOSED) \n17:00 Trade Date: 2026-01-20 (OPEN)"
            },
            {
                "date": "01/19/2026",
                "raw_text": "16:00 Trade Date: 2026-01-20 (CLOSED) \n17:00 Trade Date: 2026-01-20 (OPEN)"
            },
            {
                "date": "01/20/2026",
                "raw_text": "16:00 Trade Date: 2026-01-20 (CLOSED) \n16:45 Trade Date: 2026-01-21 (CLOSED) \n17:00 Trade Date: 2026-01-21 (OPEN)"
            }
        ],
        [
            {
                "date": "02/15/2026",
                "raw_text": "16:00 Trade Date: 2026-02-17 (CLOSED) \n17:00 Trade Date: 2026-02-17 (OPEN)"
            },
            {
                "date": "02/16/2026",
                "raw_text": "16:00 Trade Date: 2026-02-17 (CLOSED) \n17:00 Trade Date: 2026-02-17 (OPEN)"
            },
            {
                "date": "02/17/2026",
                "raw_text": "16:00 Trade Date: 2026-02-17 (CLOSED) \n16:45 Trade Date: 2026-02-18 (CLOSED) \n17:00 Trade Date: 2026-02-18 (OPEN)"
            }
        ],
        [
            {
                "date": "04/01/2026",
                "raw_text": "16:00 Trade Date: 2026-04-01 (CLOSED) \n16:45 Trade Date: 2026-04-02 (CLOSED) \n17:00 Trade Date: 2026-04-02 (OPEN)"
            },
            {
                "date": "04/02/2026",
                "raw_text": "16:00 Trade Date: 2026-04-02 (CLOSED) \n16:45 Trade Date: 2026-04-03 (CLOSED) \n17:00 Trade Date: 2026-04-03 (OPEN)"
            },
            {
                "date": "04/03/2026",
                "raw_text": "10:15 Trade Date: 2026-04-03 (CLOSED)"
            }
        ],
        [
            {
                "date": "05/24/2026",
                "raw_text": "16:00 Trade Date: 2026-05-26 (CLOSED) \n17:00 Trade Date: 2026-05-26 (OPEN)"
            },
            {
                "date": "05/25/2026",
                "raw_text": "16:00 Trade Date: 2026-05-26 (CLOSED) \n17:00 Trade Date: 2026-05-26 (OPEN)"
            },
            {
                "date": "05/26/2026",
                "raw_text": "16:00 Trade Date: 2026-05-26 (CLOSED) \n16:45 Trade Date: 2026-05-27 (CLOSED) \n17:00 Trade Date: 2026-05-27 (OPEN)"
            }
        ],
        [
            {
                "date": "06/17/2026",
                "raw_text": "16:00 Trade Date: 2026-06-17 (CLOSED) \n16:45 Trade Date: 2026-06-18 (CLOSED) \n17:00 Trade Date: 2026-06-18 (OPEN)"
            },
            {
                "date": "06/18/2026",
                "raw_text": "16:00 Trade Date: 2026-06-18 (CLOSED) \n16:45 Trade Date: 2026-06-22 (CLOSED) \n17:00 Trade Date: 2026-06-22 (OPEN)"
            },
            {
                "date": "06/19/2026",
                "raw_text": "12:00 Trade Date: 2026-06-22 (CLOSED)"
            }
        ],
        [
            {
                "date": "07/02/2026",
                "raw_text": "16:00 Trade Date: 2026-07-02 (CLOSED) \n16:45 Trade Date: 2026-07-06 (CLOSED) \n17:00 Trade Date: 2026-07-06 (OPEN)"
            },
            {
                "date": "07/03/2026",
                "raw_text": "12:00 Trade Date: 2026-07-06 (CLOSED)"
            },
            {
                "date": "07/04/2026",
                "raw_text": "CLOSED ALL DAY"
            }
        ],
        [
            {
                "date": "09/06/2026",
                "raw_text": "16:00 Trade Date: 2026-09-08 (CLOSED) \n17:00 Trade Date: 2026-09-08 (OPEN)"
            },
            {
                "date": "09/07/2026",
                "raw_text": "16:00 Trade Date: 2026-09-08 (CLOSED) \n17:00 Trade Date: 2026-09-08 (OPEN)"
            },
            {
                "date": "09/08/2026",
                "raw_text": "16:00 Trade Date: 2026-09-08 (CLOSED) \n16:45 Trade Date: 2026-09-09 (CLOSED) \n17:00 Trade Date: 2026-09-09 (OPEN)"
            }
        ],
        [
            {
                "date": "11/25/2026",
                "raw_text": "16:00 Trade Date: 2026-11-25 (CLOSED) \n16:45 Trade Date: 2026-11-27 (CLOSED) \n17:00 Trade Date: 2026-11-27 (OPEN)"
            },
            {
                "date": "11/26/2026",
                "raw_text": "16:00 Trade Date: 2026-11-27 (CLOSED) \n17:00 Trade Date: 2026-11-27 (OPEN)"
            },
            {
                "date": "11/27/2026",
                "raw_text": "13:45 Trade Date: 2026-11-27 (CLOSED)"
            }
        ],
        [
            {
                "date": "12/23/2026",
                "raw_text": "16:00 Trade Date: 2026-12-23 (CLOSED) \n16:45 Trade Date: 2026-12-24 (CLOSED) \n17:00 Trade Date: 2026-12-24 (OPEN)"
            },
            {
                "date": "12/24/2026",
                "raw_text": "12:45 Trade Date: 2026-12-24 (CLOSED)"
            },
            {
                "date": "12/25/2026",
                "raw_text": "CLOSED ALL DAY"
            }
        ],
        [
            {
                "date": "12/30/2026",
                "raw_text": "16:00 Trade Date: 2026-12-30 (CLOSED) \n16:45 Trade Date: 2026-12-31 (CLOSED) \n17:00 Trade Date: 2026-12-31 (OPEN)"
            },
            {
                "date": "12/31/2026",
                "raw_text": "16:00 Trade Date: 2026-12-31 (CLOSED)"
            },
            {
                "date": "01/01/2027",
                "raw_text": "CLOSED ALL DAY"
            }
        ]
    ],
    "Lumber": [
        [
            {
                "date": "12/31/2025",
                "raw_text": "06:00 Trade Date: 2025-12-31 (CLOSED) \n09:00 Trade Date: 2025-12-31 (OPEN) \n15:05 Trade Date: 2025-12-31 (CLOSED)"
            },
            {
                "date": "01/01/2026",
                "raw_text": "CLOSED ALL DAY"
            },
            {
                "date": "01/02/2026",
                "raw_text": "06:00 Trade Date: 2026-01-02 (CLOSED) \n09:00 Trade Date: 2026-01-02 (OPEN) \n15:05 Trade Date: 2026-01-02 (CLOSED)"
            }
        ],
        [
            {
                "date": "01/18/2026",
                "raw_text": "CLOSED ALL DAY"
            },
            {
                "date": "01/19/2026",
                "raw_text": "CLOSED ALL DAY"
            },
            {
                "date": "01/20/2026",
                "raw_text": "06:00 Trade Date: 2026-01-20 (CLOSED) \n09:00 Trade Date: 2026-01-20 (OPEN) \n15:05 Trade Date: 2026-01-20 (CLOSED)"
            }
        ],
        [
            {
                "date": "02/15/2026",
                "raw_text": "CLOSED ALL DAY"
            },
            {
                "date": "02/16/2026",
                "raw_text": "CLOSED ALL DAY"
            },
            {
                "date": "02/17/2026",
                "raw_text": "06:00 Trade Date: 2026-02-17 (CLOSED) \n09:00 Trade Date: 2026-02-17 (OPEN) \n15:05 Trade Date: 2026-02-17 (CLOSED)"
            }
        ],
        [
            {
                "date": "04/01/2026",
                "raw_text": "06:00 Trade Date: 2026-04-01 (CLOSED) \n09:00 Trade Date: 2026-04-01 (OPEN) \n15:05 Trade Date: 2026-04-01 (CLOSED)"
            },
            {
                "date": "04/02/2026",
                "raw_text": "06:00 Trade Date: 2026-04-02 (CLOSED) \n09:00 Trade Date: 2026-04-02 (OPEN) \n15:05 Trade Date: 2026-04-02 (CLOSED)"
            },
            {
                "date": "04/03/2026",
                "raw_text": "CLOSED ALL DAY"
            }
        ],
        [
            {
                "date": "05/24/2026",
                "raw_text": "CLOSED ALL DAY"
            },
            {
                "date": "05/25/2026",
                "raw_text": "CLOSED ALL DAY"
            },
            {
                "date": "05/26/2026",
                "raw_text": "06:00 Trade Date: 2026-05-26 (CLOSED) \n09:00 Trade Date: 2026-05-26 (OPEN) \n15:05 Trade Date: 2026-05-26 (CLOSED)"
            }
        ],
        [
            {
                "date": "06/17/2026",
                "raw_text": "06:00 Trade Date: 2026-06-17 (CLOSED) \n09:00 Trade Date: 2026-06-17 (OPEN) \n15:05 Trade Date: 2026-06-17 (CLOSED)"
            },
            {
                "date": "06/18/2026",
                "raw_text": "06:00 Trade Date: 2026-06-18 (CLOSED) \n09:00 Trade Date: 2026-06-18 (OPEN) \n15:05 Trade Date: 2026-06-18 (CLOSED)"
            },
            {
                "date": "06/19/2026",
                "raw_text": "CLOSED ALL DAY"
            }
        ],
        [
            {
                "date": "07/02/2026",
                "raw_text": "06:00 Trade Date: 2026-07-02 (CLOSED) \n09:00 Trade Date: 2026-07-02 (OPEN) \n15:05 Trade Date: 2026-07-02 (CLOSED)"
            },
            {
                "date": "07/03/2026",
                "raw_text": "CLOSED ALL DAY"
            },
            {
                "date": "07/04/2026",
                "raw_text": "CLOSED ALL DAY"
            }
        ],
        [
            {
                "date": "09/06/2026",
                "raw_text": "CLOSED ALL DAY"
            },
            {
                "date": "09/07/2026",
                "raw_text": "CLOSED ALL DAY"
            },
            {
                "date": "09/08/2026",
                "raw_text": "06:00 Trade Date: 2026-09-08 (CLOSED) \n09:00 Trade Date: 2026-09-08 (OPEN) \n15:05 Trade Date: 2026-09-08 (CLOSED)"
            }
        ],
        [
            {
                "date": "11/25/2026",
                "raw_text": "06:00 Trade Date: 2026-11-25 (CLOSED) \n09:00 Trade Date: 2026-11-25 (OPEN) \n15:05 Trade Date: 2026-11-25 (CLOSED)"
            },
            {
                "date": "11/26/2026",
                "raw_text": "CLOSED ALL DAY"
            },
            {
                "date": "11/27/2026",
                "raw_text": "06:00 Trade Date: 2026-11-27 (CLOSED) \n09:00 Trade Date: 2026-11-27 (OPEN) \n12:05 Trade Date: 2026-11-27 (CLOSED)"
            }
        ],
        [
            {
                "date": "12/23/2026",
                "raw_text": "06:00 Trade Date: 2026-12-23 (CLOSED) \n09:00 Trade Date: 2026-12-23 (OPEN) \n15:05 Trade Date: 2026-12-23 (CLOSED)"
            },
            {
                "date": "12/24/2026",
                "raw_text": "06:00 Trade Date: 2026-12-24 (CLOSED) \n09:00 Trade Date: 2026-12-24 (OPEN) \n12:05 Trade Date: 2026-12-24 (CLOSED)"
            },
            {
                "date": "12/25/2026",
                "raw_text": "CLOSED ALL DAY"
            }
        ],
        [
            {
                "date": "12/30/2026",
                "raw_text": "06:00 Trade Date: 2026-12-30 (CLOSED) \n09:00 Trade Date: 2026-12-30 (OPEN) \n15:05 Trade Date: 2026-12-30 (CLOSED)"
            },
            {
                "date": "12/31/2026",
                "raw_text": "06:00 Trade Date: 2026-12-31 (CLOSED) \n09:00 Trade Date: 2026-12-31 (OPEN) \n15:05 Trade Date: 2026-12-31 (CLOSED)"
            },
            {
                "date": "01/01/2027",
                "raw_text": "CLOSED ALL DAY"
            }
        ]
    ]
}